,Question,response
239,Do I have to pay extra duties or taxes for Overseas Product?,"No, all Shipped from overseas products are delivered at no additional cost to you, as the price includes customs fees and import duties. You are not expected to pay any additional duties or taxes. If you are asked by Customs or our logistic partner to pay duties, please contact our Customer Service at 0700 000 990, 0711 011 011 between 8am and 8pm on weekdays and 9am to 5pm on weekends for clarification or click on the following link and fill the form."
240,Shipped from Overseas return policy,"For items flagged as Shipped from Overseas, returns are only accepted for the below reasons:




                                    Reason
                                

                                    Description
                                



                                    Defective Item
                                

                                    Item is damaged upon delivery or not according to manufacturers specification
                                



                                    Wrong Item
                                

                                    If you received an item different from what you ordered.
                                


For example, we do not accept returns if size does not fit, or if client dislike the product (color, material, style). We encourage you to carefully check full description of the items and confirm it will meet all your expectations before placing your order"
241,How to return?,You can find how to return your products here.
242,When can I start shopping?,Special event prices become active at the time mentioned with the campaigns details. Stay tuned to jumia.co.ke for more details.
243,"Can I buy as many items as I want during special events like Black Friday, Jumia Anniversary or Mobile Week?","Usually there's no restriction on the quantity of an item you can buy but during special events like Black Friday, Jumia Anniversary or Mobile Week, we might put a restriction on some in demand items so that everybody gets a chance to enjoy our amazing deals."
244,Will the products I ordered be delivered within the regular timeline during special events like Black Friday or Mobile Week?,"Jumia ensures that all items ordered during special events like Black Friday and Mobile Week are delivered within the delivery timeline as communicated on the product page. Those may vary from usual delivery timeline, so do check the product page delivery timeline information at the moment of the order."
245,"If I place an order during a special event like Black Friday or Mobile Week but only get it four days later, does the discounted price still apply?",If your order was placed while the special promotional prices were active that's all you have to pay.
246,Why should I sell on Jumia?,"Jumia is Kenays largest e-commerce mall. With more than 6,000,000 visits every month, it gives you access to sell and deliver goods to cities and towns all over Kenya. Click here to find out more."
247,How do I register myself as a seller on Jumia?,"If you sell new and genuine products, you can register yourself immediately by visiting www.jumia.co.ke/market-place and filling out a brief form. Within 3 business days, someone from our team will get in touch with you to guide you through the rest of the process."
248,Who can sell on Jumia?,"If you sell new and genuine products, you can sell on Jumia. Click here to find out more."
249,What are the charges for selling on Jumia?,Listing products on Jumia is absolutely free! Jumia does not charge you anything for listing your products online. You only pay a small commission for what you sell. You can get to know the commission charged for your product category by contacting us on sellercenter@jumia.co.ke
250,How do I report a listing infringement?,"If you think that your Intellectual Property Right has been infringed by any of our sellers, you can click on the following link and fill the form. Click here to find out more."
251,If I have found a security Bug/Vulnerability/Issue what should I do?,"We take security very seriously at Jumia. If you're a tech guru & you have found an issue which has a real world impact, contact our Customer Service Call Center at 0700 000 990 or 0711 011 011 or click on the following link and fill the form."
